{
  "schemaVersion": "6.2",
  "generatedAt": "2025-09-22T15:00:00",
  "status": "PASS",
  "reason": "write",
  "rows": 150000,
  "landing": 2,
  "noop": false,
  "params": {
    "startFull": null,
    "startSingle": "2025-09-19",
    "end": "2025-09-19",
    "workers": 6,
    "qps": 1.6,
    "calendarCsv": ".\\cal\\trading_days.csv"
  },
  "results": {
    "single": {
      "rows": 150000,
      "landings": 2,
      "errors": 0,
      "pass": true,
      "passReason": "write",
      "csv": "C:\\\\AI\\tw-alpha-stack\\metrics\\ingest_summary_20250922-071351_finmind.csv"
    },
    "full": null
  },
  "error": null
}
